<?xml version="1.0" encoding="UTF-8"?>
<?xml-stylesheet type="text/xsl" href="../../hino.xsl"?>
<hino
    num="63"
    tit="As muitas bênçãos"
    sec="01_Louvor_e_Adoração" ass="01_11_Gratidão"
    met="11_11_11_11_Coro"
    xsi:schemaLocation="http://www.novocantico.com.br/schema/hino xsd/hino.xsd"
    xmlns="http://www.novocantico.com.br/schema/hino"
    xmlns:xsi="http://www.w3.org/2001/XMLSchema-instance">
    <tit_ori>Count your blessings</tit_ori>
    <tit_ant>Conta as muitas bênçãos</tit_ant>
    <pri_ver_ori>When upon life's billows you are tempest tossed</pri_ver_ori>
    <ori_let id="OatmanJrJ" />
    <ori_mus id="SmartER" ano="1903" />
    <ori_mus id="ExcellEO" />
    <ref_bib liv="Sl" cap="103" ver="1,2" />
    <tex>
        <est>
            <ver>Se da vida as vagas procelosas são,</ver>
            <ver>Se, com desalento, julgas tudo vão,</ver>
            <ver>Conta as muitas bênçãos, dize-as de uma vez,</ver>
            <ver>E verás, surpreso, quanto Deus já fez.</ver>
            <cor>
                <ver>Conta as bênçãos, dize quantas são,</ver>
                <ver>Recebidas da divina mão!</ver>
                <ver>Vem dizê-las, todas de uma vez,</ver>
                <ver>E verás, surpreso, quanto Deus já fez!</ver>
            </cor>
        </est>
        <est>
            <ver>Tens acaso mágoas, triste é teu lidar?</ver>
            <ver>É a cruz pesada que tens de levar?</ver>
            <ver>Conta as muitas bênçãos! Logo exultarás</ver>
            <ver>E, fortalecido, tudo vencerás!</ver>
        </est>
        <est>
            <ver>Quando vires outros com seu ouro e bens,</ver>
            <ver>Lembra que tesouros prometidos tens.</ver>
            <ver>Nunca os bens da terra poderão comprar</ver>
            <ver>A mansão celeste que vais habitar.</ver>
        </est>
        <est>
            <ver>Seja o teu combate longo ou breve aqui,</ver>
            <ver>Não te desanimes: Deus será por ti!</ver>
            <ver>Seu divino auxílio, minorando o mal,</ver>
            <ver>Te dará consolo e galardão final.</ver>
        </est>
    </tex>
</hino>